id,authors,year,title,journal,tier,citations,doi_url,topics,subtopic,priority,notes
morse_keohane_2014,Julia C. Morse; Robert O. Keohane,2014,Contested multilateralism,The Review of International Organizations,T3,601,https://doi.org/10.1007/s11558-014-9188-2,T5,全球化与治理,core,'竞争性多边主义'概念：当现有国际机构不能满足需求时，国家如何绕开或重建多边制度——理解国际秩序碎片化。
farrell_newman_2014,Henry Farrell; Abraham L. Newman,2014,Domestic Institutions beyond the Nation-State: Charting the New Interdependence Approach,World Politics,T3,214,https://doi.org/10.1017/s0043887114000057,T5,国际关系与秩序,recommended,分析超越民族国家的国内制度——全球化如何创造跨国监管网络，预示'新相互依赖'理论的制度分析维度。
liao_mcdowell_2014,Steven Liao; Daniel McDowell,2014,Redback Rising: China's Bilateral Swap Agreements and Renminbi Internationalization,International Studies Quarterly,T3,143,https://doi.org/10.1111/isqu.12161,T1,人民币国际化与替代体系,recommended,研究中国双边货币互换协议与人民币国际化：中国如何通过金融外交推进'人民币崛起'。
murdie_peksen_2012,Amanda Murdie; Dursun Peksen,2012,The impact of human rights INGO activities on economic sanctions,The Review of International Organizations,T3,111,https://doi.org/10.1007/s11558-012-9146-9,T1,其他,recommended,研究人权INGO活动如何影响经济制裁的实施——非政府组织的倡导网络在制裁决策中的作用。
head_etal_2026,Keith Head; Thierry Mayer; Marc Melitz et al.,2026,Industrial Policies for Multi-Stage Production: The Battle for Battery-Powered Vehicles,National Bureau of Economic Research,WP,0,https://doi.org/10.3386/w34884,T3,其他,reference,分析多阶段生产中的产业政策：各国围绕电动汽车电池产业链的政策竞争——产业政策的地缘政治维度。
aiyar_etal_2023,Shekhar Aiyar; Anna Ilyina; Jiaqian Chen et al.,2023,Geo-Economic Fragmentation and the Future of Multilateralism,IMF staff discussion note,WP,270,https://doi.org/10.5089/9798400229046.006,T5,全球化与治理,recommended,IMF报告：分析地缘经济碎片化对多边体系的威胁——贸易脱钩、技术分裂和金融去全球化对全球经济的长期影响。
alfaro_chor_2023,Laura Alfaro; Davin Chor,2023,Global Supply Chains: The Looming “Great Reallocation”,National Bureau of Economic Research,WP,116,https://doi.org/10.3386/w31661,"T3,T5",全球价值链与生产网络,recommended,分析全球供应链'大重新配置'的前景——地缘政治紧张如何驱动跨国企业重组全球生产网络。
arslanalp_etal_2022,Serkan Arslanalp; Chima Simpson-Bell; Barry Eichengreen,2022,The Stealth Erosion of Dollar Dominance: Active Diversifiers and the Rise of Nontraditional Reserve Currencies,IMF Working Paper,WP,94,https://doi.org/10.5089/9798400204746.001,T1,美元霸权与储备多元化,reference,记录美元在全球储备中份额的'隐形侵蚀'——各国央行主动多元化转向非传统储备货币（人民币等），挑战美元霸权。
fajgelbaum_etal_2022,Pablo Fajgelbaum; Pinelopi Goldberg; Patrick Kennedy et al.,2022,The US-China Trade War and Global Reallocations,"World Bank, Washington, DC eBooks",WP,56,https://doi.org/10.1596/1813-9450-9894,T2,关税与贸易战,reference,中美贸易战全球重新配置效应的工作论文版本——更早的分析和方法论细节。
fajgelbaum_etal_2021,Pablo Fajgelbaum; Pinelopi Goldberg; Patrick Kennedy et al.,2021,The US-China Trade War and Global Reallocations,National Bureau of Economic Research,WP,77,https://doi.org/10.3386/w29562,T2,关税与贸易战,reference,中美贸易战全球重新配置效应的早期版本——追踪贸易流向转变的实证证据。
coppola_etal_2020,Antonio Coppola; Matteo Maggiori; Brent Neiman et al.,2020,Redrawing the Map of Global Capital Flows: The Role of Cross-Border Financing and Tax Havens,National Bureau of Economic Research,WP,128,https://doi.org/10.3386/w26855,T2,产业政策,recommended,全球资本流动地图重绘的工作论文版——剥离壳公司后的真实FDI地理。
blanchard_etal_2019,Emily J. Blanchard; Chad P. Bown; Davin Chor,2019,Did Trump's Trade War Impact the 2018 Election?,National Bureau of Economic Research,WP,92,https://doi.org/10.3386/w26434,T2,关税与贸易战,reference,研究特朗普贸易战是否影响了2018年中期选举——贸易政策的政治经济反馈效应。
blanchard_etal_2016,Emily J. Blanchard; Chad P. Bown; Robert C. Johnson,2016,Global Supply Chains and Trade Policy,National Bureau of Economic Research,WP,148,https://doi.org/10.3386/w21883,"T2,T3",关税与贸易战,recommended,分析全球供应链如何改变各国贸易政策激励——上下游产业链接使保护主义成本更高，改变了最优关税计算。
bown_2010,Chad P. Bown,2010,"Taking stock of antidumping, safeguards, and countervailing duties, 1990-2009","World Bank, Washington, DC eBooks",WP,139,https://doi.org/10.1596/1813-9450-5436,T2,反倾销与贸易救济,recommended,盘点1990-2009年全球反倾销、保障措施和反补贴税使用趋势的工作论文版本。
ossa_2010,Ralph Ossa,2010,A 'New Trade' Theory of GATT/WTO Negotiations,National Bureau of Economic Research,WP,63,https://doi.org/10.3386/w16388,T2,贸易自由化与福利,reference,GATT/WTO贸易谈判'新贸易'理论的工作论文版本。
baldwin_2025,Richard Baldwin,2025,"Global supply chains : why they emerged, why they matter, and where they are going",Graduate Institute Geneva Institutional Repository (Graduate Institute of International and Development Studies),other,405,https://doi.org/10.71609/iheid-2ykv-0p36,"T3,T5",荷兰病与资源经济,recommended,Richard Baldwin综述全球供应链的起源、重要性和未来走向——分析技术变革和地缘政治如何重塑全球生产格局。
luo_assche_2023,Yadong Luo; Ari Van Assche,2023,The rise of techno-geopolitical uncertainty: Implications of the United States CHIPS and Science Act,Journal of International Business Studies,other,249,https://doi.org/10.1057/s41267-023-00620-3,"T4,T5",出口管制与技术限制,recommended,提出'技术-地缘政治不确定性'概念：分析美国CHIPS法案如何改变全球半导体产业的投资和创新格局。
schindler_etal_2023,Seth Schindler; Ilias Alami; Jessica DiCarlo et al.,2023,"The Second Cold War: US-China Competition for Centrality in Infrastructure, Digital, Production, and Finance Networks",Geopolitics,other,174,https://doi.org/10.1080/14650045.2023.2253432,"T4,T5",其他,recommended,分析中美'第二次冷战'——在基础设施、数字经济和绿色转型领域争夺全球中心性的竞争。
roberts_etal_2020,Huw Roberts; Josh Cowls; Jessica Morley et al.,2020,"The Chinese approach to artificial intelligence: an analysis of policy, ethics, and regulation",AI & Society,other,496,https://doi.org/10.1007/s00146-020-00992-2,"T1,T4,T5",人民币国际化与替代体系,recommended,系统分析中国的人工智能发展路径——政策框架、伦理考量和国际标准竞争，是理解中美AI竞争的关键参考。
chang_andreoni_2020,Ha‐Joon Chang; Antonio Andreoni,2020,Industrial Policy in the 21st Century,Development and Change,other,421,https://doi.org/10.1111/dech.12570,T2,产业政策,recommended,Ha-Joon Chang论21世纪产业政策——为什么产业政策回归？新一代产业政策的理论基础和实践模式。
hfner_tagliapietra_2020,Manfred Häfner; Simone Tagliapietra,2020,The Geopolitics of the Global Energy Transition,Lecture notes in energy,other,223,https://doi.org/10.1007/978-3-030-39066-2,"T3,T5",能源安全与地缘政治,recommended,分析全球能源转型的地缘政治维度——清洁能源如何重塑能源出口国与进口国的权力关系。
petricevi_teece_2019,Olga Petricević; David J. Teece,2019,"The structural reshaping of globalization: Implications for strategic sectors, profiting from innovation, and the multinational enterprise",Journal of International Business Studies,other,444,https://doi.org/10.1057/s41267-019-00269-x,"T2,T3",FDI与跨国企业,recommended,分析全球化的结构性重塑——地缘政治、技术变革和制度碎片化如何改变跨国企业的战略部门和知识产权保护。
rodrik_2018,Dani Rodrik,2018,Understanding Economic Policy Reform,,other,1283,https://doi.org/10.4324/9780429498893-10,"T2,T5",其他,core,Dani Rodrik论经济政策改革——全球化背景下发展中国家的政策空间、制度约束和改革路径。
rodrik_2018_b,Dani Rodrik,2018,Populism and the economics of globalization,Journal of International Business Policy,other,1268,https://doi.org/10.1057/s42214-018-0001-4,"T2,T5",其他,core,分析贸易协定到底做了什么——超越传统的市场准入视角，揭示现代贸易协定如何重塑国内制度和监管空间。
wade_2018,Robert Wade,2018,The Developmental State: Dead or Alive?,Development and Change,other,304,https://doi.org/10.1111/dech.12381,T5,其他,recommended,分析'发展型国家'模式是否仍然有效——东亚产业政策经验对当代产业政策辩论（如中国模式）的启示。
blackwill_harris_2016,Robert D. Blackwill; Jennifer Harris,2016,War by Other Means: Geoeconomics and Statecraft,,other,305,https://doi.org/10.4159/9780674545960,"T1,T5",经济胁迫理论,recommended,'以其他手段进行的战争'：地缘经济学与治国术——系统论述经济工具（制裁、贸易、金融）如何服务于地缘政治目标。
afesorgbor_mahadevan_2016,Sylvanus Kwaku Afesorgbor; Renuka Mahadevan,2016,The Impact of Economic Sanctions on Income Inequality of Target States,World Development,other,202,https://doi.org/10.1016/j.worlddev.2016.03.015,"T1,T5",其他,recommended,研究经济制裁对目标国收入不平等的影响——制裁的分配效应分析，揭示制裁对普通民众vs.精英的差异化冲击。
